{"test_id":"FORA-ACT-2026-001","batch_id":"read-only-batch","parent_sandbox":"read-only","configured_max_threads":6,"configured_max_depth":1,"results":[{"requested_custom_agent_name":"equinesync_segregated_review_agent","child_identifier":"/root/act_02_read_only_batch","es_ra_role":"ES-RA-02","registration_marker":"ES-RA-02-REGISTERED-V1.0.0","expected_sandbox":"read-only","custom_instruction_layer_acknowledged":true,"calibration_only":true,"substantive_work_performed":false,"files_written":[],"network_used":false},{"requested_custom_agent_name":"equinesync_adversarial_challenge_agent","child_identifier":"/root/act_03_read_only_batch","es_ra_role":"ES-RA-03","registration_marker":"ES-RA-03-REGISTERED-V1.0.0","expected_sandbox":"read-only","custom_instruction_layer_acknowledged":true,"calibration_only":true,"substantive_work_performed":false,"files_written":[],"network_used":false},{"requested_custom_agent_name":"equinesync_domain_reviewer","child_identifier":"/root/act_06_read_only_batch","es_ra_role":"ES-RA-06","registration_marker":"ES-RA-06-REGISTERED-V1.0.0","expected_sandbox":"read-only","custom_instruction_layer_acknowledged":true,"calibration_only":true,"substantive_work_performed":false,"files_written":[],"network_used":false}]}